Title,Original Title,Subtitle,Series,Volume,Author,"Author (Last, First)",Illustrator,Narrator,Translator,Photographer,Editor,Publisher,Place of Publication,Date Published,Year Published,Original Date Published,Original Year Published,Edition,Genre,Summary,Guided Reading Level,Lexile Measure,Lexile Code,Grade Level Equivalent,Developmental Reading Assessment,Interest Level,AR Level,AR Points,AR Quiz Number,Word Count,Number of Pages,Format,Audio Runtime,Dimensions,Weight,List Price,Language,Original Language,DDC,LCC,LCCN,OCLC,ISBN,ISSN,Favorites,Rating,Physical Location,Status,Status Incompleted Reason,Status Hidden,Date Started,Date Finished,Current Page,Loaned To,Date Loaned,Borrowed From,Date Borrowed,Returned from Borrow,Not Owned Reason,Quantity,Condition,Recommended By,Date Added,User Supplied ID,User Supplied Descriptor,Tags,Purchase Date,Purchase Place,Purchase Price,Notes,Google VolumeID,Category,Wish List,Previously Owned,Up Next,Position,Uploaded Image URL,Activities
The Making of the Atomic Bomb,,T 12517,,,"Richard Rhodes,Richard Lee Rhodes,Richard. (Nuclear). Rhodes","Rhodes, Richard",,,,,,Simon & Schuster,,,1986,,,,History,"A gripping, authoritative account of the men, women, science, drama and intrigue behind the single most important event of the century: the discovery of nuclear energy and construction of the atomic bomb. 32 pages of black-and-white photographs.",,,,,,,,,,,886,,,,,,English,,,,,,9780671441333,,0,0,,Unread,,0,,,,,,,,0,,,,,2022/09/23 14:49:53,,,,,,,,lUBSAQAAIAAJ,,0,0,0,,,
The Norton History of Astronomy and Cosmology,,NEEDS - Troy,,,"John North,John David North","North, John",,,,,,Norton,,,1994,,,,History,"In this book, the author recounts the development of celestial knowledge from prehistory to Stephen Hawking and the Hubble Space Telescope, from the megalithic observatory at Stonehenge, through the great early civilizations of the Maya, Egypt, and China, to the discoveries of Copernicus, Galileo, Kepler, Newton, and the scientists of our own day. The result is a brilliant, engaging history of humanity's quest to understand its place in the cosmos.",,,,,,,,,,,697,,,,,,English,,,,,,9780393311938,,0,0,,Unread,,0,,,,,,,,0,,,,,2022/09/23 14:49:30,,,,,,,,NoB5QgAACAAJ,,0,0,0,,,
Manhattan Project: The Untold Story of the Making of the Atomic Bomb,,T 1836,,,Stéphane Groueff,"Groueff, Stéphane",,,,,,Little Brown & Company,,,1967,,,,Atomic bomb,"Describes the scientists, technicians, and businesses who participated in America's 3-year project to construct the atomic bomb",,,,,,,,,,,372,,,,,,English,,,,,,9780316329736,,0,0,,Unread,,0,,,,,,,,0,,,,,2022/09/23 14:48:41,,,,,,,,667vwQEACAAJ,,0,0,0,,,
Dialogues Concerning Two New Sciences,,T 1815,,,Galileo Galilei,"Galilei, Galileo",,,,,,Courier Corporation,,1954/01/01,1954,,,,Science,"Geometric demonstrations of fracture of solid bodies, speed of light and sound, pendulums, falling bodies, accelerated motion, etc.",,,,,,,,,,,300,,,,,,English,,,,,,9780486600994,,0,0,,Unread,,0,,,,,,,,0,,,,,2022/09/23 14:46:53,,,,,,,,BvyG03NrbC8C,,0,0,0,,,
Berlin Noir,,T 100009,,,Philip Kerr,"Kerr, Philip",,,,,,Penguin,,1994/01/01,1994,,,,Fiction,"Now in one volume—the first three novels in Philip Kerr’s New York Times bestselling historical mystery series starring hard-boiled detective Bernie Gunther...“A Chandleresque knight errant caught in insane historical surroundings. Bernie walks down streets so mean that nobody can stay alive and remain truly clean.”—John Powers, Fresh Air (NPR)Ex-policeman Bernie Gunther thought he'd seen everything on the streets of 1930s Berlin. But then he went freelance, and each case he tackled sucked him further into the grisly excesses of Nazi subculture. And even after the war, amidst the decayed, imperial splendour of Vienna, Bernie uncovered a legacy that made the wartime atrocities look lily-white in comparison...This collection includes:MARCH VIOLETSTHE PALE CRIMINALA GERMAN REQUIEM",,,,,,,,,,,848,,,,,,English,,,,,,9780140231700,,0,0,,Unread,,0,,,,,,,,0,,,,,2022/04/29 10:06:15,,,,,,,,XC-VXYm5ZxEC,,0,0,0,,,
Ghettoside: A True Story of Murder in America,,T 100008,,,Jill Leovy,"Leovy, Jill",,,,,,Spiegel & Grau,,,2015,,,,Social Science,"NEW YORK TIMES BESTSELLERA masterly work of literary journalism about a senseless murder, a relentless detective, and the great plague of homicide in AmericaOn a warm spring evening in South Los Angeles, a young man is shot and killed on a sidewalk minutes away from his home, one of the thousands of black Americans murdered that year. His assailant runs down the street, jumps into an SUV, and vanishes, hoping to join the scores of killers in American cities who are never arrested for their crimes.But as soon as the case is assigned to Detective John Skaggs, the odds shift.Here is the kaleidoscopic story of the quintessential, but mostly ignored, American murder—a “ghettoside” killing, one young black man slaying another—and a brilliant and driven cadre of detectives whose creed is to pursue justice for forgotten victims at all costs. Ghettoside is a fast-paced narrative of a devastating crime, an intimate portrait of detectives and a community bonded in tragedy, and a surprising new lens into the great subject of why murder happens in our cities—and how the epidemic of killings might yet be stopped.Praise for Ghettoside“[Jill Leovy writes] with grace and artistry, and controlled—but bone-deep—outrage in her new book. . . .Ghettoside, if there's any justice, will be the most important book about urban violence in a generation.”—David M. Kennedy,The Washington Post “Moving and engrossing.”—San Francisco Chronicle“A serious and kaleidoscopic achievement . . . [Leovy is] a crisp writer with a crisp mind and the ability to boil entire skies of information into hard journalistic rain.”—Dwight Garner,The New York Times“Leovy's relentless reporting has produced a book packed with valuable, hard-won insights—and it serves as a crucial, 366-page reminder that 'black lives matter.' ”—The New York Times Book Review“Masterful . . . gritty reporting that matches the police work behind it.”—Los Angeles Times“Functions both as a snappy police procedural and—more significantly—as a searing indictment of legal neglect . . . Leovy's powerful testimony demands respectful attention.”—The Boston Globe“A compelling analysis of the factors behind the epidemic of black-on-black homicide, and the beginnings of a policy prescription for tackling it . . . an important book, which deserves a wide audience.”—Hari Kunzru,The Guardian“Ghettoside has many successes: its complicated portrait of the LAPD, the humanity it lends to the families of murder victims, and its ability to engage readers from a historical and current-day context (the sundry facts Leovy provides throughout the book never overwhelm).”—Jason Parham, Gawker“A brave book . . . It is not often that I pick up a work of non-fiction and picture the movie unfolding before my eyes. . . . [Ghettoside] offers a calm dissection of America's oldest epidemic. . . . [Leovy's] knowledge makes for lapidary prose that crackles with insight. It is also deeply humane.”—Financial Times“Penetrating and heartbreaking . . . Ghettoside points out how relatively little America has cared even as recently as the last decade about the value of young black men's lives.”—USA Today",,,,,,,,,,,366,,,,,,English,,,,,,9780385529983,,0,0,,Unread,,0,,,,,,,,0,,,,,2022/04/29 10:05:29,,,,,,,,DkmMDQAAQBAJ,,0,0,0,,,
The Wolfling,,T 100007,,,Sterling North,"North, Sterling",,,,,,Puffin Books,,,1992,,,,Juvenile Fiction,"The Newbery Honor-winning author of Rascal presents a classic story about a boy's best friend--who's half dog, half wolf, and all heart. With ingenuity and hard work, Robbie Trent manages to convince his parents and his wolf-hating neighbors that Wolf is as hard-working as any dog. Illustrator John Schoenherr won a Caldecott Medal for his artwork on Owl Moon.",,,,,,,,,,,224,,,,,,English,,,,,,9780140361667,,0,0,,Unread,,0,,,,,,,,0,,,,,2022/04/29 10:04:47,,,,,,,,FCYglKmgcYoC,,0,0,0,,,
To Kill a Mockingbird,,T 100006,,,Harper Lee,"Lee, Harper",,,,,,Grand Central Publishing,,1988/10/11,1988,,,,Fiction,"The unforgettable novel of a childhood in a sleepy Southern town and the crisis of conscience that rocked it, To Kill A Mockingbird became both an instant bestseller and a critical success when it was first published in 1960. It went on to win the Pulitzer Prize in 1961 and was later made into an Academy Award-winning film, also a classic. Compassionate, dramatic, and deeply moving, To Kill A Mockingbird takes readers to the roots of human behavior - to innocence and experience, kindness and cruelty, love and hatred, humor and pathos. Now with over 18 million copies in print and translated into forty languages, this regional story by a young Alabama woman claims universal appeal. Harper Lee always considered her book to be a simple love story. Today it is regarded as a masterpiece of American literature.",,,,,,,,,,,384,,,,,,English,,,,,,9780446310789,,0,0,,Unread,,0,,,,,,,,0,,,,,2022/04/29 10:04:01,,,,,,,,0XkBzQEACAAJ,,0,0,0,,https://covers.openlibrary.org/b/id/285196-L.jpg,
Traveling Mercies: Some Thoughts on Faith,,T 100005,,,Anne Lamott,"Lamott, Anne",,,,,,Anchor Books,,2000/02/01,2000,,,,Biography & Autobiography,"Anne Lamott claims the two best prayers she knows are: ""Help me, help me, help me"" and ""Thank you, thank you, thank you."" She has a friend whose morning prayer each day is ""Whatever,"" and whose evening prayer is ""Oh, well."" Anne thinks of Jesus as ""Casper the friendly savior"" and describes God as ""one crafty mother.""Despite--or because of--her irreverence, faith is a natural subject for Anne Lamott. Since Operating Instructions and Bird by Bird, her fans have been waiting for her to write the book that explained how she came to the big-hearted, grateful, generous faith that she so often alluded to in her two earlier nonfiction books. The people in Anne Lamott's real life are like beloved characters in a favorite series for her readers--her friend Pammy, her son, Sam, and the many funny and wise folks who attend her church are all familiar. And Traveling Mercies is a welcome return to those lives, as well as an introduction to new companions Lamott treats with the same candor, insight, and tenderness. Lamott's faith isn't about easy answers, which is part of what endears her to believers as well as nonbelievers. Against all odds, she came to believe in God and then, even more miraculously, in herself. As she puts it, ""My coming to faith did not start with a leap but rather a series of staggers."" At once tough, personal, affectionate, wise, and very funny, Traveling Mercies tells in exuberant detail how Anne Lamott learned to shine the light of faith on the darkest part of ordinary life, exposing surprising pockets of meaning and hope.",,,,,,,,,,,275,,,,,,English,,,,,,9780385496094,,0,0,,Unread,,0,,,,,,,,0,,,,,2022/04/29 10:03:21,,,,,,,,7ZUdHJoYeIcC,,0,0,0,,,
"Country of My Skull: Guilt, Sorrow, and the Limits of Forgiveness in the New South Africa",,T 100004,,,Antjie Krog,"Krog, Antjie",,,,,,Three River Press,,,2000,,,,History,"Ever since Nelson Mandela dramatically walked out of prison in 1990 after twenty-seven years behind bars, South Africa has been undergoing a radical transformation. In one of the most miraculous events of the century, the oppressive system of apartheid was dismantled. Repressive laws mandating separation of the races were thrown out. The country, which had been carved into a crazy quilt that reserved the most prosperous areas for whites and the most desolate and backward for blacks, was reunited. The dreaded and dangerous security force, which for years had systematically tortured, spied upon, and harassed people of color and their white supporters, was dismantled. But how could this country--one of spectacular beauty and promise--come to terms with its ugly past? How could its people, whom the oppressive white government had pitted against one another, live side by side as friends and neighbors?To begin the healing process, Nelson Mandela created the Truth and Reconciliation Commission, headed by the renowned cleric Archbishop Desmond Tutu. Established in 1995, the commission faced the awesome task of hearing the testimony of the victims of apartheid as well as the oppressors. Amnesty was granted to those who offered a full confession of any crimes associated with apartheid. Since the commission began its work, it has been the central player in a drama that has riveted the country. In this book, Antjie Krog, a South African journalist and poet who has covered the work of the commission, recounts the drama, the horrors, the wrenching personal stories of the victims and their families. Through the testimonies of victims of abuse and violence, from the appearance of Winnie Mandela to former South African president P. W. Botha's extraordinary courthouse press conference, this award-winning poet leads us on an amazing journey.Country of My Skull captures the complexity of the Truth Commission's work. The narrative is often traumatic, vivid, and provocative. Krog's powerful prose lures the reader actively and inventively through a mosaic of insights, impressions, and secret themes. This compelling tale is Antjie Krog's profound literary account of the mending of a country that was in colossal need of change.",,,,,,,,,,,423,,,,,,English,,,,,,9780812931297,,0,0,,Unread,,0,,,,,,,,0,,,,,2022/04/29 10:02:38,,,,,,,,zOuMDQAAQBAJ,,0,0,0,,,
Coming of age in Samoa: a psychological study of primitive youth for Western civilization,,T 100003,,,Margaret Mead,"Mead, Margaret",,,,,,P. Smith],,,,,,,Adolescence,,,,,,,,,,,,304,,,,,,,,,,,,9780688309749,,0,0,,Unread,,0,,,,,,,,0,,,,,2022/04/29 10:01:46,,,,,,,,,,0,0,0,,https://covers.openlibrary.org/b/id/11686939-L.jpg,
Ever Since Darwin: Reflections in Natural History,,T 100002,,,Stephen Jay Gould,"Gould, Stephen Jay",,,,,,W. W. Norton & Company,,1992/07/17,1992,,,,Fiction,"More than any other modern scientists, Stephen Jay Gould has opened up to millions the wonders of evolutionary biology. His genius as an essayist lies in his unmatched ability to use his knowledge of the world, including popular culture, to illuminate the realm of science. Ever Since Darwin, Stephen Jay Gould's first book, has sold more than a quarter of a million copies. Like all succeeding collections by this unique writer, it brings the art of the scientific essay to unparalleled heights.",,,,,,,,,,,285,,,,,,English,,,,,,9780393308181,,0,0,,Unread,,0,,,,,,,,0,,,,,2022/04/29 10:00:52,,,,,,,,GR-uAgAAQBAJ,,0,0,0,,,
Bread Givers,,T 100001,,,Anzia Yezierska,"Yezierska, Anzia",,,,,,Persea Books,,,2003,,,,Fiction,"This masterwork of American immigrant literature is set in the 1920s on the Lower East Side of Manhattan and tells the story of Sara Smolinsky, the youngest daughter of an Orthodox rabbi, who rebels against her father's rigid conception of Jewish womanhood. Sarah's struggle towards independence and self-fulfillment resonates with a passion all can share. Beautifully redesigned page for page with the previous editions, Bread Givers is an essential historical work with enduring relevance.",,,,,,,,,,,297,,,,,,English,,,,,,9780892552900,,0,0,,Unread,,0,,,,,,,,0,,,,,2022/04/29 10:00:13,,,,,,,,zYf2zgEACAAJ,,0,0,0,,,
Lord of the Flies,,T 100000,,,William Golding,"Golding, William",,,,,,Penguin,,1997/08/01,1997,,,,Fiction,"Before The Hunger Games there was Lord of the FliesLord of the Flies remains as provocative today as when it was first published in 1954, igniting passionate debate with its startling, brutal portrait of human nature. Though critically acclaimed, it was largely ignored upon its initial publication. Yet soon it became a cult favorite among both students and literary critics who compared it to J.D. Salinger's The Catcher in the Rye in its influence on modern thought and literature.William Golding's compelling story about a group of very ordinary small boys marooned on a coral island has become a modern classic. At first it seems as though it is all going to be great fun; but the fun before long becomes furious and life on the island turns into a nightmare of panic and death. As ordinary standards of behaviour collapse, the whole world the boys know collapses with them—the world of cricket and homework and adventure stories—and another world is revealed beneath, primitive and terrible.Labeled a parable, an allegory, a myth, a morality tale, a parody, a political treatise, even a vision of the apocalypse, Lord of the Flies has established itself as a true classic.""Lord of the Flies is one of my favorite books. That was a big influence on me as a teenager, I still read it every couple of years."" —Suzanne Collins, author of The Hunger Games""As exciting, relevant, and thought-provoking now as it was when Golding published it in 1954.""—Stephen King",,,,,,,,,,,272,,,,,,English,,,,,,9781573226127,,0,0,,Unread,,0,,,,,,,,0,,,,,2022/04/29 9:59:19,,,,,,,,Hq1PEAAAQBAJ,,0,0,0,,,
Moneyball: The Art of Winning an Unfair Game,,T 100059,,,Michael Lewis,"Lewis, Michael",,,,,,W. W. Norton & Company,,2004/03/17,2004,,,,Business & Economics,"Moneyball is a quest for the secret of success in baseball. Following the low-budget Oakland Athletics, their larger-than-life general manger, Billy Beane, and the strange brotherhood of amateur baseball enthusiasts, Michael Lewis has written not only ""the single most influential baseball book ever"" (Rob Neyer, Slate) but also what ""may be the best book ever written on business"" (Weekly Standard).I wrote this book because I fell in love with a story. The story concerned a small group of undervalued professional baseball players and executives, many of whom had been rejected as unfit for the big leagues, who had turned themselves into one of the most successful franchises in Major League Baseball. But the idea for the book came well before I had good reason to write it--before I had a story to fall in love with. It began, really, with an innocent question: how did one of the poorest teams in baseball, the Oakland Athletics, win so many games?With these words Michael Lewis launches us into the funniest, smartest, and most contrarian book since, well, since Liar's Poker. Moneyball is a quest for something as elusive as the Holy Grail, something that money apparently can't buy: the secret of success in baseball. The logical places to look would be the front offices of major league teams, and the dugouts, perhaps even in the minds of the players themselves. Lewis mines all these possibilities--his intimate and original portraits of big league ballplayers are alone worth the price of admission--but the real jackpot is a cache of numbers--numbers!--collected over the years by a strange brotherhood of amateur baseball enthusiasts: software engineers, statisticians, Wall Street analysts, lawyers and physics professors.What these geek numbers show--no, prove--is that the traditional yardsticks of success for players and teams are fatally flawed. Even the box score misleads us by ignoring the crucial importance of the humble base-on-balls. This information has been around for years, and nobody inside Major League Baseball paid it any mind. And then came Billy Beane, General Manager of the Oakland Athletics.Billy paid attention to those numbers --with the second lowest payroll in baseball at his disposal he had to--and this book records his astonishing experiment in finding and fielding a team that nobody else wanted. Moneyball is a roller coaster ride: before the 2002 season opens, Oakland must relinquish its three most prominent (and expensive) players, is written off by just about everyone, and then comes roaring back to challenge the American League record for consecutive wins.In a narrative full of fabulous characters and brilliant excursions into the unexpected, Michael Lewis shows us how and why the new baseball knowledge works. He also sets up a sly and hilarious morality tale: Big Money, like Goliath, is always supposed to win...how can we not cheer for David?",,,,,,,,,,,317,,,,,,English,,,,,,9780393324815,,0,0,,Unread,,0,,,,,,,,0,,,,,2022/04/29 9:56:34,,,,,,,,3DnUCWSnci0C,,0,0,0,,,
The Israel-Arab Reader: A Documentary History of the Middle East Conflict,,T 100058,,,Walter Laqueur,"Laqueur, Walter",,,,,,Penguin Books,,,2008,,,,History,"An essential resource?completely revised and updated for the sixtieth anniversary of the founding of IsraelIn print for forty years , The Israel-Arab Reader is a thorough and up-to-date guide to the continuing crisis in the Middle East. It covers the full spectrum of the Israel-Arab conflict?including a new chapter recounting the Gaza withdrawal, the Hamas election victory, and the Lebanon-Israel War. Featuring a new introduction that provides an overview of the past 115 years of conflict, and arranged chronologically and without bias, this comprehensive reference includes speeches, letters, articles, timelines, and reports dealing with all the major interests in the area.",,,,,,,,,,,626,,,,,,English,,,,,,9780143113799,,0,0,,Unread,,0,,,,,,,,0,,,,,2022/04/29 9:56:22,,,,,,,,R4t7PwAACAAJ,,0,0,0,,,
Sophie's World: A Novel About the History of Philosophy,,T 100057,,,Jostein Gaarder,"Gaarder, Jostein",,,,,,"Farrar, Straus and Giroux",,2007/03/20,2007,,,,Fiction,"A page-turning novel that is also an exploration of the great philosophical concepts of Western thought, Sophie's World has fired the imagination of readers all over the world, with more than twenty million copies in print.One day fourteen-year-old Sophie Amundsen comes home from school to find in her mailbox two notes, with one question on each: ""Who are you?"" and ""Where does the world come from?"" From that irresistible beginning, Sophie becomes obsessed with questions that take her far beyond what she knows of her Norwegian village. Through those letters, she enrolls in a kind of correspondence course, covering Socrates to Sartre, with a mysterious philosopher, while receiving letters addressed to another girl. Who is Hilde? And why does her mail keep turning up? To unravel this riddle, Sophie must use the philosophy she is learning—but the truth turns out to be far more complicated than she could have imagined.",,,,,,,,,,,544,,,,,,English,,,,,,9780374530716,,0,0,,Unread,,0,,,,,,,,0,,,,,2022/04/29 9:55:36,,,,,,,,-o1MPwAACAAJ,,0,0,0,,,
The Odyssey by Homer,,T 100056,,,Homer,Homer,,,,,,Independently Published,,2020/12/19,2020,,,,,"This excellent prose translation of Homer's epic poem of the 9th century BC recounts one of Western civilization's most glorious tales, a treasury of Greek folklore and myth that maintains an ageless appeal for modern readers. A cornerstone of Western literature, The Odyssey narrates the path of a fascinatingly complex hero through a world of wonders and danger-filled adventure.After ten bloody years of fighting in the Trojan War, the intrepid Odysseus heads homeward, little imagining that it will take another ten years of desperate struggle to reclaim his kingdom and family. The wily hero circumvents the wrath of the sea god Poseidon and triumphs over an incredible array of obstacles, assisted by his patron goddess Athene and his own prodigious guile. From a literal descent into Hell to interrogate a dead prophet to a sojourn in the earthly paradise of the Lotus-eaters, the gripping narrative traverses the mythological world of ancient Greece to introduce an unforgettable cast of characters: one-eyed giants known as Cyclopses, the enchantress Circe, cannibals, sirens, the twin perils of Scylla and Charybdis, and a fantastic assortment of other creatures.",,,,,,,,,,,183,,,,,,English,,,,,,9798583960774,,0,0,,Unread,,0,,,,,,,,0,,,,,2022/04/29 9:49:59,,,,,,,,nxkezgEACAAJ,,0,0,0,,,
