Title,Original Title,Subtitle,Series,Volume,Author,"Author (Last, First)",Illustrator,Narrator,Translator,Photographer,Editor,Publisher,Place of Publication,Date Published,Year Published,Original Date Published,Original Year Published,Edition,Genre,Summary,Guided Reading Level,Lexile Measure,Lexile Code,Grade Level Equivalent,Developmental Reading Assessment,Interest Level,AR Level,AR Points,AR Quiz Number,Word Count,Number of Pages,Format,Audio Runtime,Dimensions,Weight,List Price,Language,Original Language,DDC,LCC,LCCN,OCLC,ISBN,ISSN,Favorites,Rating,Physical Location,Status,Status Incompleted Reason,Status Hidden,Date Started,Date Finished,Current Page,Loaned To,Date Loaned,Borrowed From,Date Borrowed,Returned from Borrow,Not Owned Reason,Quantity,Condition,Recommended By,Date Added,User Supplied ID,User Supplied Descriptor,Tags,Purchase Date,Purchase Place,Purchase Price,Notes,Google VolumeID,Category,Wish List,Previously Owned,Up Next,Position,Uploaded Image URL,Activities
The Discovery of Subatomic Particles Revised Edition,,T 13113,,,"Steven Weinberg,Austin) Steven (University of Texas Weinberg","Weinberg, Steven",,,,,,Cambridge University Press,,2003/09/01,2003,,,,Science,"This commentary on the discovery of the atom's constituents provides an historical account of key events in the physics of the twentieth century that led to the discoveries of the electron, proton and neutron. Steven Weinberg introduces the fundamentals of classical physics that played crucial roles in these discoveries. Connections are shown throughout the book between the historic discoveries of subatomic particles and contemporary research at the frontiers of physics, including the most current discoveries of new elementary particles. Steven Weinberg was Higgins Professor of Physics at Harvard before moving to The University of Texas at Austin, where he founded its Theory Group. At Texas he holds the Josey Regental Chair of Science and is a member of the Physics and Astronomy Departments. His research has spanned a broad range of topics in quantum field theory, elementary particle physics, and cosmology, and has been honored with numerous awards, including the Nobel Prize in Physics, the National Medal of Science, the Heinemann Prize in Mathematical Physics, the Cresson Medal of the Franklin Institute, the Madison Medal of Princeton University, and the Oppenheimer Prize. In addition to the well-known treatise, Gravitation and Cosmololgy, he has written several books for general readers, including the prize-winning The First Three Minutes (now translated into 22 foreign languages), and most recently Dreams of a Final Theory (Pantheon Books, 1993). He has also written a textbook The Quantum Theory of Fields, Vol.I, Vol. II, and Vol. III (Cambridge).",,,,,,,,,,,206,,,,,,English,,,,,,9780521823517,,0,0,,Unread,,0,,,,,,,,0,,,,,2022/09/23 15:04:48,,,,,,,,zWwLE0LpnLwC,,0,0,0,,,
"Instant Physics: From Aristotle to Einstein, and Beyond",,T 11240,,,Tony Rothman,"Rothman, Tony",,,,,,Fawcett Columbine,,,1995,,,,Reference,"For all of you who break out in a sweat at the thought of thermodynamics, or freeze up at the mention of quantum mechanics, like a bolt from the blue, INSTANT PHYSICS will zap you through the fascinating history of our most basic, yet baffling, science. From the thousand-year search for proof of the existence of the ever-elusive atom to the varied and heated arguments behind the big bang theory, INSTANT PHYSICS answers all the heavy questions with a light touch. You'll learn: * How the Greek philosophers used the sledgehammer of mathematics to break apart the mysteries of the physical universe. * Why gravity is a ""romantic"" force. * How to tell the difference between a gluon, a meson, and a quark, even if you can't see them. INSTANT PHYSICS is crammed with special features, including chapter summaries, who's who lists, biographical and historical tidbits, and a host of illustrations, photos, equations, diagrams, and drawings.",,,,,,,,,,,242,,,,,,English,,,,,,9780449906972,,0,0,,Unread,,0,,,,,,,,0,,,,,2022/09/23 15:04:34,,,,,,,,CwFAAQAAIAAJ,,0,0,0,,,
The Cartoon Guide to Physics,,T 11976,,,"Larry Gonick,Art Huffman","Gonick, Larry",,,,,,HarperPerennial,,,1991,,,,Science,You don't have to be a scientist to understand science--especially now that the Cartoon Guide to Physics explains even the most complex theories of physics with simplicity and wit. This book puts the principles of physics into the grasp of every reader.,,,,,,,,,,,212,,,,,,English,,,,,,9780064636186,,0,0,,Unread,,0,,,,,,,,0,,,,,2022/09/23 15:04:15,,,,,,,,oTAbAQAAIAAJ,,0,0,0,,,
The Facts on File Encyclopedia of Science: A-K,,T 14010,,,Inc Facts on File,"File, Inc Facts on",,,,,,Facts on File,,,1999,,,,Science,"Arranged alphabetically and covering the broadest range of topics imaginable, this two-volume resource is fully indexed and cross-referenced, with clearly designed tables, lists, formulae, maps, and diagrams. It is accessible to all audiences and offers authoritative, user-friendly, and thoroughly fascinating insight into science and technology.",,,,,,,,,,,840,,,,,,English,,,,,,9780816040070,,0,0,,Unread,,0,,,,,,,,0,,,,,2022/09/23 15:04:00,,,,,,,,8zRuSgAACAAJ,,0,0,0,,https://covers.openlibrary.org/b/id/3740815-L.jpg,
The Facts on File Encyclopedia of Science: L-Z,,NEEDS NEW - Troy,,,Inc Facts on File,"File, Inc Facts on",,,,,,Facts on File,,,1999,,,,Science,"Arranged alphabetically and covering the broadest range of topics imaginable, this two-volume resource is fully indexed and cross-referenced, with clearly designed tables, lists, formulae, maps, and diagrams. It is accessible to all audiences and offers authoritative, user-friendly, and thoroughly fascinating insight into science and technology.",,,,,,,,,,,840,,,,,,English,,,,,,9780816040070,,0,0,,Unread,,0,,,,,,,,0,,,,,2022/09/23 15:02:58,,,,,,,,8zRuSgAACAAJ,,0,0,0,,https://covers.openlibrary.org/b/id/3740815-L.jpg,
Encyclopedia of Sports Science Vol II,,T 11299,,,John Zumerchik,"Zumerchik, John",,,,,,Macmillan Library Reference USA,,,1997,,,,Sports sciences,"1997 Booklist Editor s Choice Reference This one-of-a-kind Encyclopedia presents physics in a refreshingly new way . . . by emphasizing the sports and not the science! Without the intimidating jargon, scientific information is cleverly interwoven with sports facts and stories. This balance between technical scientific information and interesting sports references makes the Encyclopedia accessible to readers of all types. For students with an interest in sports and an aversion to science, there is no better way to introduce them to important physical, biological, medical, and scientific principles!",,,,,,,,,,,943,,,,,,English,,,,,,9780028646664,,0,0,,Unread,,0,,,,,,,,0,,,,,2022/09/23 15:01:50,,,,,,,,qJgYAAAAIAAJ,,0,0,0,,,
Encyclopedia of Sports Science,,T 11300,,,John Zumerchik,"Zumerchik, John",,,,,,Macmillan Library Reference USA,,,1997,,,,Sports sciences,"1997 Booklist Editor s Choice Reference This one-of-a-kind Encyclopedia presents physics in a refreshingly new way . . . by emphasizing the sports and not the science! Without the intimidating jargon, scientific information is cleverly interwoven with sports facts and stories. This balance between technical scientific information and interesting sports references makes the Encyclopedia accessible to readers of all types. For students with an interest in sports and an aversion to science, there is no better way to introduce them to important physical, biological, medical, and scientific principles!",,,,,,,,,,,943,,,,,,English,,,,,,9780028646664,,0,0,,Unread,,0,,,,,,,,0,,,,,2022/09/23 15:01:03,,,,,,,,qJgYAAAAIAAJ,,0,0,0,,,
General Chemistry,,T 12065,,,Linus Pauling,"Pauling, Linus",,,,,,Courier Corporation,,1988/04/01,1988,,,,Science,"""An excellent text, highly recommended."" — ChoiceWhen it was first published, this first-year chemistry text revolutionized the teaching of chemistry by presenting it in terms of unifying principles instead of as a body of unrelated facts. Those principles included modern theories of atomic and molecular structure, quantum mechanics, statistical mechanics, and thermodynamics. In addition, Dr. Pauling attempted to correlate the theories with descriptive chemistry, the observed properties of substances, to introduce the student to the multitude of chemical substances and their properties.In this extensively revised and updated third edition, the Nobel Prize–winning author maintains an excellent balance between theoretical and descriptive material, although the amount of descriptive chemistry has been decreased somewhat, and the presentation of the subject, especially in relation to the nonmetals, has been revised in such a way as to permit greater correlation with the electronic structure of atoms, especially electronegativity.The principles of quantum mechanics are discussed on the basis of the de Broglie wavelength of the electron. The quantized energy levels of a particle in a box are derived by means of a simple assumption about the relation of the de Broglie waves to the walls of the box. No attempt is made to solve the Schrödinger wave equation for other systems, but the wave functions of hydrogen-like electrons are presented and discussed in some detail, and the quantum states for other systems are also covered. Statistical mechanics is introduced before thermodynamics, and the discussion of thermodynamics is based on it. This arrangement reflects the author's belief that beginning students can understand statistical mechanics better than chemical thermodynamics. Aimed at first-year college students who plan to major in chemistry or closely related fields, the book is written in a logical, clear, and understandable style. In addition, many excellent figures are included, along with numerous problems and 75 pages of appendices covering such topics as symmetry of molecules and crystals, hybrid bond orbitals, and magnetic properties of substances.",,,,,,,,,,,959,,,,,,English,,,,,,9780486656229,,0,0,,Unread,,0,,,,,,,,0,,,,,2022/09/23 14:59:42,,,,,,,,VeTcCgAAQBAJ,,0,0,0,,,
A Brief History of Time,,T 1754,,,Stephen W. Hawking,"Hawking, Stephen W.",,,,,,Bantam Books,,,1998,,,,Science,"#1 NEW YORK TIMES BESTSELLERA landmark volume in science writing by one of the great minds of our time, Stephen Hawking's book explores such profound questions as: How did the universe begin—and what made its start possible? Does time always flow forward? Is the universe unending—or are there boundaries? Are there other dimensions in space? What will happen when it all ends?Told in language we all can understand, A Brief History of Time plunges into the exotic realms of black holes and quarks, of antimatter and “arrows of time,” of the big bang and a bigger God—where the possibilities are wondrous and unexpected. With exciting images and profound imagination, Stephen Hawking brings us closer to the ultimate secrets at the very heart of creation.",,,,,,,,,,,223,,,,,,English,,,,,,9780553380163,,0,0,,Unread,,0,,,,,,,,0,,,,,2022/09/23 14:59:26,,,,,,,,iOBT0qN8DKUC,,0,0,0,,,
The Macmillan dictionary of measurement,,T 11343,,,Michael Darton,"Darton, Michael",,,,,,Macmillan,,,1994,,,,Dictionaries,,,,,,,,,,,,538,,,,,,,,,,,,9780025257504,,0,0,,Unread,,0,,,,,,,,0,,,,,2022/09/23 14:58:32,,,,,,,,,,0,0,0,,https://covers.openlibrary.org/b/id/12805776-L.jpg,
Introduction to Concepts and Theories in Physical Science,,T 1794,,,"Gerald James Holton,Stephen G. Brush","Holton, Gerald James",,,,,,Princeton University Press,,,1985,,,,Physical sciences,"The Description for this book, Introduction to Concepts and Theories in Physical Science, will be forthcoming.",,,,,,,,,,,589,,,,,,English,,,,,,9780691083841,,0,0,,Unread,,0,,,,,,,,0,,,,,2022/09/23 14:58:10,,,,,,,,goe7QgAACAAJ,,0,0,0,,https://covers.openlibrary.org/b/id/12775198-L.jpg,
The Universe in a Nutshell,,T 13431,,,Stephen Hawking,"Hawking, Stephen",,,,,,Bantam Books,,,2001,,,,Science,"Stephen Hawking's phenomenal, multimillion-copy bestseller, A Brief History of Time, introduced the ideas of this brilliant theoretical physicist to readers all over the world. Now, in a major publishing event, Hawking returns with a lavishly illustrated sequel that unravels the mysteries of the major breakthroughs that have occurred in the years since the release of his acclaimed first book.The Universe in a Nutshell• Quantum mechanics• M-theory• General relativity• 11-dimensional supergravity• 10-dimensional membranes• Superstrings• P-branes• Black holesOne of the most influential thinkers of our time, Stephen Hawking is an intellectual icon, known not only for the adventurousness of his ideas but for the clarity and wit with which he expresses them. In this new book Hawking takes us to the cutting edge of theoretical physics, where truth is often stranger than fiction, to explain in laymen's terms the principles that control our universe.Like many in the community of theoretical physicists, Professor Hawking is seeking to uncover the grail of science — the elusive Theory of Everything that lies at the heart of the cosmos. In his accessible and often playful style, he guides us on his search to uncover the secrets of the universe — from supergravity to supersymmetry, from quantum theory to M-theory, from holography to duality. He takes us to the wild frontiers of science, where superstring theory and p-branes may hold the final clue to the puzzle. And he lets us behind the scenes of one of his most exciting intellectual adventures as he seeks “to combine Einstein's General Theory of Relativity and Richard Feynman's idea of multiple histories into one complete unified theory that will describe everything that happens in the universe.”With characteristic exuberance, Professor Hawking invites us to be fellow travelers on this extraordinary voyage through space-time. Copious four-color illustrations help clarify this journey into a surreal wonderland where particles, sheets, and strings move in eleven dimensions; where black holes evaporate and disappear, taking their secret with them; and where the original cosmic seed from which our own universe sprang was a tiny nut.The Universe in a Nutshell is essential reading for all of us who want to understand the universe in which we live. Like its companion volume, A Brief History of Time, it conveys the excitement felt within the scientific community as the secrets of the cosmos reveal themselves.",,,,,,,,,,,216,,,,,,English,,,,,,9780553802023,,0,0,,Unread,,0,,,,,,,,0,,,,,2022/09/23 14:57:48,,,,,,,,0CO2iwfzRJkC,,0,0,0,,,
"Rainbows, Snowflakes, and Quarks: Physics and the World Around Us",,T 1799,,,Hans Christian Von Baeyer,"Baeyer, Hans Christian Von",,,,,,McGraw-Hill,,,1984,,,,Science,"Discusses the principles of physics at work in a variety of everyday occurrences including whirlpools, lightening, waves, warmth, and motion",,,,,,,,,,,192,,,,,,English,,,,,,9780070675452,,0,0,,Unread,,0,,,,,,,,0,,,,,2022/09/23 14:57:27,,,,,,,,MbHvAAAAMAAJ,,0,0,0,,,
Einstein's Theory of Relativity,,T 12444,,,Max Born,"Born, Max",,,,,,Courier Corporation,,2012/05/23,2012,,,,Science,"A book in which one great mind explains the work of another great mind in terms comprehensible to the layman is a significant achievement. This is such a book. Max Born is a Nobel Laureate (1955) and one of the world's great physicists: in this book he analyzes and interprets the theory of Einsteinian relativity. The result is undoubtedly the most lucid and insightful of all the books that have been written to explain the revolutionary theory that marked the end of the classical and the beginning of the modern era of physics.The author follows a quasi-historical method of presentation. The book begins with a review of the classical physics, covering such topics as origins of space and time measurements, geometric axioms, Ptolemaic and Copernican astronomy, concepts of equilibrium and force, laws of motion, inertia, mass, momentum and energy, Newtonian world system (absolute space and absolute time, gravitation, celestial mechanics, centrifugal forces, and absolute space), laws of optics (the corpuscular and undulatory theories, speed of light, wave theory, Doppler effect, convection of light by matter), electrodynamics (including magnetic induction, electromagnetic theory of light, electromagnetic ether, electromagnetic laws of moving bodies, electromagnetic mass, and the contraction hypothesis). Born then takes up his exposition of Einstein's special and general theories of relativity, discussing the concept of simultaneity, kinematics, Einstein's mechanics and dynamics, relativity of arbitrary motions, the principle of equivalence, the geometry of curved surfaces, and the space-time continuum, among other topics. Born then points out some predictions of the theory of relativity and its implications for cosmology, and indicates what is being sought in the unified field theory.This account steers a middle course between vague popularizations and complex scientific presentations. This is a careful discussion of principles stated in thoroughly acceptable scientific form, yet in a manner that makes it possible for the reader who has no scientific training to understand it. Only high school algebra has been used in explaining the nature of classical physics and relativity, and simple experiments and diagrams are used to illustrate each step. The layman and the beginning student in physics will find this an immensely valuable and usable introduction to relativity. This Dover 1962 edition was greatly revised and enlarged by Dr. Born.",,,,,,,,,,,400,,,,,,English,,,,,,9780486142128,,0,0,,Unread,,0,,,,,,,,0,,,,,2022/09/23 14:57:01,,,,,,,,bdhQAQAAQBAJ,,0,0,0,,,
Hydro Sourcebook: the true story of a lone genius who solved the greatest scientific problem of his time,,T 115235,,,Dava Sobel,"Sobel, Dava",,,,,,GITC,,,1995,,,,Royal Society,"The dramatic human story of an epic scientific quest and of one man's forty-year obsession to find a solution to the thorniest scientific dilemma of the day--""the longitude problem.""

Anyone alive in the eighteenth century would have known that ""the longitude problem"" was the thorniest scientific dilemma of the day-and had been for centuries.  Lacking the ability to measure their longitude, sailors throughout the great ages of exploration had been literally lost at sea as soon as they lost sight of land.  Thousands of lives and the increasing fortunes of nations hung on a resolution.  One man, John Harrison, in complete opposition to the scientific community, dared to imagine a mechanical solution-a clock that would keep precise time at sea, something no clock had ever been able to do on land.

Longitude is the dramatic human story of an epic scientific quest and of Harrison's forty-year obsession with building his perfect timekeeper, known today as the chronometer.  Full of heroism and chicanery, it is also a fascinating brief history of astronomy, navigation, and clockmaking, and opens a new window on our world.",,,,,,,,,,,358,,,,,,English,,,,,,9780802713124,,0,0,,Unread,,0,,,,,,,,0,,,,,2022/09/23 14:53:17,,,,,,,,lDscAQAAIAAJ,,0,0,0,,https://covers.openlibrary.org/b/id/570731-L.jpg,
The Hole in the Universe: How Scientists Peered Over the Edge of Emptiness and Found Everything,,T 13334,,,K. C. Cole,"Cole, K. C.",,,,,,Harcourt,,,2001,,,,Science,"Welcome to the world of cutting-edge math, physics, and neuroscience, where the search for the ultimate vacuum, the point of nothingness, ground zero of theory, has rendered the universe deep, rich, and juicy. ""Modern physics has animated the void,"" says K. C. Cole in her entrancing journey into the heart of Nothing. Every time scientists and mathematicians think they have reached the ultimate void, new stuff appears: a black hole, an undulating string, an additional dimension of space or time, repulsive anti-gravity, universes that breed like bunnies. Cole's exploration at the edge of everything is as animated and exciting as the void itself. Take Cole's hand on this adventure into the unknown, and you'll come back informed, amused, and excited.",,,,,,,,,,,274,,,,,,English,,,,,,9780151003983,,0,0,,Unread,,0,,,,,,,,0,,,,,2022/09/23 14:52:39,,,,,,,,KXhWzgEACAAJ,,0,0,0,,,
Time Travel in Einstein's Universe: The Physical Possibilities of Travel Through Time,,T 13424,,,J. Richard Gott,"Gott, J. Richard",,,,,,Houghton Mifflin,,,2001,,,,Science,"Time travel in Newton's universe was inconceivable, but in Einstein's universe it has become a possibility. J. Richard Gott III, a Princeton astrophysicist who is a leading researcher in the field, gives readers a guided tour of the potential of traveling through time. Although scientists such as Stephen Hawking and Kip Thorne have previously considered the topic, the delightfully refreshing — but scrupulously careful — Gott goes light-years beyond them in his exploration of this exciting idea. Gott begins by describing how the finest science fiction about time travel has inspired some of today's top scientific ideas on the subject. He goes on to explain how travel to the future is not only possible but has actually happened (astronauts have aged a bit less than we whose feet have stayed solidly on earth), and he examines whether travel to the past might also be possible, given certain physical conditions. He then offers up his most stunning material: the study of time travel can be used to discover whether the universe could have created itself. Finally, asserting that no book on time travel would be complete without a report from the future, Gott predicts the span of human existence, based on a scientific technique he has developed. His conclusion is humbling but wondrous: just in the short time we have lived so far, consider how much we have already learned about the universe. TIME TRAVEL IN EINSTEIN'S UNIVERSE is a book to read not only for its extraordinary subject matter and scientific brilliance but for its joyful writing.",,,,,,,,,,,291,,,,,,English,,,,,,9780395955635,,0,0,,Unread,,0,,,,,,,,0,,,,,2022/09/23 14:51:59,,,,,,,,qqXuAAAAMAAJ,,0,0,0,,,
Black Holes and Baby Universes and Other Essays,,T 1808,,,Stephen Hawking,"Hawking, Stephen",,,,,,Bantam Books,,,1993,,,,Science,"""In his phenomenal bestseller A Brief History of Time, Stephen Hawking literally transformed the way we think about physics, the universe, reality itself. Widely regarded as the most brilliant theoretical physicist since Einstein, he has opened our minds to today's most important scientific ideas about the cosmos. Now Stephen Hawking returns to shed new light on the darkest regions of space and time ... and to reveal an extraordinary array of possibilities for our understanding of the universe."" ""These thirteen essays and one remarkable extended interview broadcast over the BBC on Christmas day 1992 range from the autobiographical to the purely scientific. Building on his earlier work, Stephen Hawking discusses imaginary time, how black holes can give birth to baby universes, and scientists' efforts to find a complete unified theory that would predict everything in the universe, a concept that he believes will come to seem as natural to the next generation as the idea that the world is round."" ""With the great unfolding mysteries of the universe as a backdrop, Stephen Hawking also reflects on free will, the value of life, and his perceptions of death. He looks at how science theory converges with - and diverges from - science fiction, as well as how science fact interfaces with our own lives."" ""The pieces in this collection reveal Stephen Hawking variously as the scientist, the concerned world citizen, the man, and - always - the rigorous and imaginative thinker. Severely disabled by ALS - Lou Gehrig's disease - he describes the way in which this has affected but not constrained his personal and intellectual life: from the special computer technology that lets him translate his thoughts into words and his words into sounds, enabling him to write and speak, to the process of evolving his ideas, teaching his students, and working with his colleagues."". ""Using his characteristic mastery of language, his sense of humor, his commitment to plain speaking, and his disdain for pompousness, Stephen Hawking invites us in this book to know him better and to share his passion for the voyage of intellect and imagination that has opened new ways to understanding the very nature of the universe.""--Jacket",,,,,,,,,,,182,,,,,,English,,,,,,9780553374117,,0,0,,Unread,,0,,,,,,,,0,,,,,2022/09/23 14:51:24,,,,,,,,gTLGnTZabBQC,,0,0,0,,,
Chaos: Making a New Science,,T 22,,,James Gleick,"Gleick, James",,,,,,Penguin,,,1988,,,,Science,"The author describes how scientists studying the growth of complexity in nature are discovering order and pattern in chaos. He explains concepts such as nonlinearity, the Butterfly Effect, universal constants, fractals, and strange attractors, and examines the work of scientists such as Mitchell J. Feigenbaum, Edward Lorenz, and Benoit Mandelbrot.",,,,,,,,,,,352,,,,,,English,,,,,,9780140092509,,0,0,,Unread,,0,,,,,,,,0,,,,,2022/09/23 14:50:59,,,,,,,,upcJCIH8M_oC,,0,0,0,,,
The Unexpected Vista: A Physicist's View of Nature,,T 1798,,,James Trefil,"Trefil, James",,,,,,Scribner,,,1983,,,,Science,"Examines twelve carefully chosen questions to clarify modern physicists' view of the world, from cosmos to subatomic particles, and to show how every natural phenomenon can be explained in terms of one or more general principles",,,,,,,,,,,209,,,,,,English,,,,,,9780684178691,,0,0,,Unread,,0,,,,,,,,0,,,,,2022/09/23 14:50:39,,,,,,,,cBgsAQAAIAAJ,,0,0,0,,,
